{
  "initiative": "Community Energy Retrofit Pilot",
  "goal": "Reduce household energy burden while improving residential efficiency.",
  "sdg_theme": "Affordable and clean energy",
  "indicator": "Average monthly bill reduction",
  "unit": "USD",
  "baseline_value": 0,
  "current_value": 18,
  "target_value": 30,
  "baseline_period": "2025 baseline",
  "current_period": "2026 Q2",
  "source": "Pilot utility-billing sample and participant survey summary",
  "method_notes": "Current value is the observed average monthly bill reduction across participating households compared with baseline average bills. Results should be reviewed for seasonality and household-size differences.",
  "confidence": "medium",
  "review_status": "needs_review",
  "beneficiaries": 420,
  "budget_usd": 125000,
  "higher_is_better": true
}